<?xml version="1.0" encoding="UTF-8"?>
<!DOCTYPE materials SYSTEM "../DTD/materials.dtd">
<materials>
<!--

   $Id: HcalMaterials.xml,v 1.1 2007-02-02 18:19:32 marcocle Exp $ 
   CVS tag $Name: not supported by cvs2svn $
   $Log: not supported by cvs2svn $
   Revision 1.1.1.1  2007/01/30 13:34:59  marcocle
   CVS based back up for the SQLite conditions database

   Revision 1.4  2003/12/05 13:59:43  cattanem
   add Calo changes

   Revision 1.3  2002/09/12 09:33:11  cattanem
   Add vertical Rich, Velo optimisation

   Revision 1.2  2002/01/19 16:20:32  aberdiou
    new description of Hcal
-->

<catalog name="Hcal">
  <!-- %%%%%%              Hcal Master Plate Steel               %%%%%% -->
  <material name = "HcalMsPlSteel" 
            density = "7.87*g/cm3">
      <component name = "Iron"    fractionmass = "0.97"/>
      <component name = "Carbon"  fractionmass = "0.03"/>
  </material>
  <!-- %%%%%%                   Hcal Strip Steel                 %%%%%% -->
  <material name = "HcalStripSteel" 
            density = "7.87*g/cm3">
      <component name = "Iron"    fractionmass = "0.97"/>
      <component name = "Carbon"  fractionmass = "0.03"/>
  </material>
  <!-- %%%%%%             Hcal Inner Support Steel               %%%%%% -->
  <material name = "HcalSupportSteel" 
            density = "7.87*g/cm3">
      <component name = "Iron"    fractionmass = "0.97"/>
      <component name = "Carbon"  fractionmass = "0.03"/>
  </material>
  <!-- %%%%%%     Hcal Scintillator: Polystyrene (C6H5CH=CH2)    %%%%%% -->
  <material  name = "HcalSc"
             density = "1.032*g/cm3"
             radlen = "42.4*cm"
             lambda = "79.46*cm">
    <component name = "Hydrogen" natoms = "8"/>
    <component name = "Carbon" natoms = "8"/>
  </material>
  <!-- %%%%%%     Hcal Support: Pb   %%%%%% -->
    <element  name = "HcalPb"
              symbol = "Pb"
              density = "11.35*g/cm3"
              radlen = "0.56*cm"
              lambda = "17.09*cm">
             <atom A = "207.2*g/mole"
             Zeff = "82.0"/>
    </element>
 
</catalog>
</materials>
